{
  "schema": "cs_partition/1",
  "generated_by": "8672b2d",
  "params": {"prime_pool_bound": 200, "disc_bound": 2000000, "max_r": 4, "residue_class": "1 mod 4", "route": "Hirano mod-2 DW (N(eps)=-1)", "n_included": 1308, "n_excluded_pell": 657},
  "aggregate": {"all_match": true, "strata": {"even_all_even": 46, "even_all_odd": 151, "even_mixed": 325, "odd_all_even": 184, "odd_all_odd": 0, "odd_mixed": 602}},
  "instances": [
    {"primes": [5,13], "r": 2, "z_lhs": 0, "z_rhs": 0, "match": true, "phase_class": "all_odd"},
    {"primes": [5,13,17], "r": 3, "z_lhs": 0, "z_rhs": 0, "match": true, "phase_class": "mixed"},
    {"primes": [5,13,17,29], "r": 4, "z_lhs": 0, "z_rhs": 0, "match": true, "phase_class": "mixed"},
    {"primes": [5,13,17,37], "r": 4, "z_lhs": 0, "z_rhs": 0, "match": true, "phase_class": "mixed"},
    {"primes": [5,13,17,53], "r": 4, "z_lhs": 0, "z_rhs": 0, "match": true, "phase_class": "all_odd"},
    {"primes": [5,13,17,61], "r": 4, "z_lhs": 0, "z_rhs": 0, "match": true, "phase_class": "mixed"},
    {"primes": [5,13,17,89], "r": 4, "z_lhs": 0, "z_rhs": 0, "match": true, "phase_class": "mixed"},
    {"primes": [5,13,17,113], "r": 4, "z_lhs": 0, "z_rhs": 0, "match": true, "phase_class": "mixed"},
    {"primes": [5,13,17,137], "r": 4, "z_lhs": 0, "z_rhs": 0, "match": true, "phase_class": "mixed"},
    {"primes": [5,13,17,149], "r": 4, "z_lhs": 0, "z_rhs": 0, "match": true, "phase_class": "mixed"},
    {"primes": [5,13,17,157], "r": 4, "z_lhs": 0, "z_rhs": 0, "match": true, "phase_class": "all_odd"},
    {"primes": [5,13,17,173], "r": 4, "z_lhs": 0, "z_rhs": 0, "match": true, "phase_class": "mixed"},
    {"primes": [5,13,17,181], "r": 4, "z_lhs": 0, "z_rhs": 0, "match": true, "phase_class": "mixed"},
    {"primes": [5,13,29,37], "r": 4, "z_lhs": 0, "z_rhs": 0, "match": true, "phase_class": "mixed"},
    {"primes": [5,13,29,41], "r": 4, "z_lhs": 0, "z_rhs": 0, "match": true, "phase_class": "mixed"},
    {"primes": [5,13,29,61], "r": 4, "z_lhs": 0, "z_rhs": 0, "match": true, "phase_class": "all_odd"},
    {"primes": [5,13,29,73], "r": 4, "z_lhs": 0, "z_rhs": 0, "match": true, "phase_class": "mixed"},
    {"primes": [5,13,29,89], "r": 4, "z_lhs": 0, "z_rhs": 0, "match": true, "phase_class": "mixed"},
    {"primes": [5,13,29,97], "r": 4, "z_lhs": 0, "z_rhs": 0, "match": true, "phase_class": "mixed"},
    {"primes": [5,13,29,113], "r": 4, "z_lhs": 0, "z_rhs": 0, "match": true, "phase_class": "mixed"},
    {"primes": [5,13,29,137], "r": 4, "z_lhs": 0, "z_rhs": 0, "match": true, "phase_class": "mixed"},
    {"primes": [5,13,29,149], "r": 4, "z_lhs": 0, "z_rhs": 0, "match": true, "phase_class": "mixed"},
    {"primes": [5,13,29,157], "r": 4, "z_lhs": 0, "z_rhs": 0, "match": true, "phase_class": "mixed"},
    {"primes": [5,13,29,173], "r": 4, "z_lhs": 0, "z_rhs": 0, "match": true, "phase_class": "mixed"},
    {"primes": [5,13,29,193], "r": 4, "z_lhs": 0, "z_rhs": 0, "match": true, "phase_class": "mixed"},
    {"primes": [5,13,37], "r": 3, "z_lhs": 4, "z_rhs": 4, "match": true, "phase_class": "all_even"},
    {"primes": [5,13,37,41], "r": 4, "z_lhs": 0, "z_rhs": 0, "match": true, "phase_class": "mixed"},
    {"primes": [5,13,37,53], "r": 4, "z_lhs": 0, "z_rhs": 0, "match": true, "phase_class": "mixed"},
    {"primes": [5,13,37,61], "r": 4, "z_lhs": 0, "z_rhs": 0, "match": true, "phase_class": "mixed"},
    {"primes": [5,13,37,73], "r": 4, "z_lhs": 0, "z_rhs": 0, "match": true, "phase_class": "mixed"},
    {"primes": [5,13,37,109], "r": 4, "z_lhs": 0, "z_rhs": 0, "match": true, "phase_class": "mixed"},
    {"primes": [5,13,37,113], "r": 4, "z_lhs": 0, "z_rhs": 0, "match": true, "phase_class": "mixed"},
    {"primes": [5,13,37,149], "r": 4, "z_lhs": 0, "z_rhs": 0, "match": true, "phase_class": "mixed"},
    {"primes": [5,13,37,157], "r": 4, "z_lhs": 0, "z_rhs": 0, "match": true, "phase_class": "mixed"},
    {"primes": [5,13,37,173], "r": 4, "z_lhs": 0, "z_rhs": 0, "match": true, "phase_class": "mixed"},
    {"primes": [5,13,37,181], "r": 4, "z_lhs": 8, "z_rhs": 8, "match": true, "phase_class": "all_even"},
    {"primes": [5,13,41], "r": 3, "z_lhs": 0, "z_rhs": 0, "match": true, "phase_class": "mixed"},
    {"primes": [5,13,41,73], "r": 4, "z_lhs": 0, "z_rhs": 0, "match": true, "phase_class": "mixed"},
    {"primes": [5,13,41,89], "r": 4, "z_lhs": 0, "z_rhs": 0, "match": true, "phase_class": "mixed"},
    {"primes": [5,13,41,97], "r": 4, "z_lhs": 0, "z_rhs": 0, "match": true, "phase_class": "mixed"},
    {"primes": [5,13,41,101], "r": 4, "z_lhs": 0, "z_rhs": 0, "match": true, "phase_class": "mixed"},
    {"primes": [5,13,41,109], "r": 4, "z_lhs": 0, "z_rhs": 0, "match": true, "phase_class": "mixed"},
    {"primes": [5,13,41,113], "r": 4, "z_lhs": 0, "z_rhs": 0, "match": true, "phase_class": "mixed"},
    {"primes": [5,13,41,149], "r": 4, "z_lhs": 0, "z_rhs": 0, "match": true, "phase_class": "mixed"},
    {"primes": [5,13,41,173], "r": 4, "z_lhs": 0, "z_rhs": 0, "match": true, "phase_class": "mixed"},
    {"primes": [5,13,41,181], "r": 4, "z_lhs": 0, "z_rhs": 0, "match": true, "phase_class": "mixed"},
    {"primes": [5,13,41,197], "r": 4, "z_lhs": 0, "z_rhs": 0, "match": true, "phase_class": "mixed"},
    {"primes": [5,13,53], "r": 3, "z_lhs": 0, "z_rhs": 0, "match": true, "phase_class": "mixed"},
    {"primes": [5,13,53,61], "r": 4, "z_lhs": 0, "z_rhs": 0, "match": true, "phase_class": "mixed"},
    {"primes": [5,13,53,89], "r": 4, "z_lhs": 0, "z_rhs": 0, "match": true, "phase_class": "mixed"},
    {"primes": [5,13,53,97], "r": 4, "z_lhs": 0, "z_rhs": 0, "match": true, "phase_class": "mixed"},
    {"primes": [5,13,53,101], "r": 4, "z_lhs": 0, "z_rhs": 0, "match": true, "phase_class": "mixed"},
    {"primes": [5,13,53,109], "r": 4, "z_lhs": 8, "z_rhs": 8, "match": true, "phase_class": "all_even"},
    {"primes": [5,13,53,113], "r": 4, "z_lhs": 0, "z_rhs": 0, "match": true, "phase_class": "all_odd"},
    {"primes": [5,13,53,149], "r": 4, "z_lhs": 0, "z_rhs": 0, "match": true, "phase_class": "mixed"},
    {"primes": [5,13,53,157], "r": 4, "z_lhs": 0, "z_rhs": 0, "match": true, "phase_class": "mixed"},
    {"primes": [5,13,53,173], "r": 4, "z_lhs": 0, "z_rhs": 0, "match": true, "phase_class": "mixed"},
    {"primes": [5,13,53,181], "r": 4, "z_lhs": 0, "z_rhs": 0, "match": true, "phase_class": "mixed"},
    {"primes": [5,13,53,197], "r": 4, "z_lhs": 0, "z_rhs": 0, "match": true, "phase_class": "mixed"},
    {"primes": [5,13,61,73], "r": 4, "z_lhs": 8, "z_rhs": 8, "match": true, "phase_class": "all_even"},
    {"primes": [5,13,61,89], "r": 4, "z_lhs": 0, "z_rhs": 0, "match": true, "phase_class": "mixed"},
    {"primes": [5,13,61,137], "r": 4, "z_lhs": 8, "z_rhs": 8, "match": true, "phase_class": "all_even"},
    {"primes": [5,13,61,157], "r": 4, "z_lhs": 0, "z_rhs": 0, "match": true, "phase_class": "mixed"},
    {"primes": [5,13,61,173], "r": 4, "z_lhs": 0, "z_rhs": 0, "match": true, "phase_class": "mixed"},
    {"primes": [5,13,61,181], "r": 4, "z_lhs": 0, "z_rhs": 0, "match": true, "phase_class": "all_odd"},
    {"primes": [5,13,61,193], "r": 4, "z_lhs": 0, "z_rhs": 0, "match": true, "phase_class": "mixed"},
    {"primes": [5,13,73], "r": 3, "z_lhs": 4, "z_rhs": 4, "match": true, "phase_class": "all_even"},
    {"primes": [5,13,73,89], "r": 4, "z_lhs": 0, "z_rhs": 0, "match": true, "phase_class": "mixed"},
    {"primes": [5,13,73,101], "r": 4, "z_lhs": 0, "z_rhs": 0, "match": true, "phase_class": "mixed"},
    {"primes": [5,13,73,109], "r": 4, "z_lhs": 0, "z_rhs": 0, "match": true, "phase_class": "mixed"},
    {"primes": [5,13,73,113], "r": 4, "z_lhs": 0, "z_rhs": 0, "match": true, "phase_class": "mixed"},
    {"primes": [5,13,73,149], "r": 4, "z_lhs": 0, "z_rhs": 0, "match": true, "phase_class": "mixed"},
    {"primes": [5,13,73,157], "r": 4, "z_lhs": 0, "z_rhs": 0, "match": true, "phase_class": "mixed"},
    {"primes": [5,13,73,173], "r": 4, "z_lhs": 0, "z_rhs": 0, "match": true, "phase_class": "mixed"},
    {"primes": [5,13,89], "r": 3, "z_lhs": 0, "z_rhs": 0, "match": true, "phase_class": "mixed"},
    {"primes": [5,13,89,97], "r": 4, "z_lhs": 0, "z_rhs": 0, "match": true, "phase_class": "mixed"},
    {"primes": [5,13,89,101], "r": 4, "z_lhs": 0, "z_rhs": 0, "match": true, "phase_class": "mixed"},
    {"primes": [5,13,89,109], "r": 4, "z_lhs": 0, "z_rhs": 0, "match": true, "phase_class": "all_odd"},
    {"primes": [5,13,89,149], "r": 4, "z_lhs": 0, "z_rhs": 0, "match": true, "phase_class": "mixed"},
    {"primes": [5,13,89,157], "r": 4, "z_lhs": 0, "z_rhs": 0, "match": true, "phase_class": "mixed"},
    {"primes": [5,13,89,173], "r": 4, "z_lhs": 0, "z_rhs": 0, "match": true, "phase_class": "mixed"},
    {"primes": [5,13,89,181], "r": 4, "z_lhs": 0, "z_rhs": 0, "match": true, "phase_class": "mixed"},
    {"primes": [5,13,97], "r": 3, "z_lhs": 4, "z_rhs": 4, "match": true, "phase_class": "all_even"},
    {"primes": [5,13,97,101], "r": 4, "z_lhs": 8, "z_rhs": 8, "match": true, "phase_class": "all_even"},
    {"primes": [5,13,97,109], "r": 4, "z_lhs": 0, "z_rhs": 0, "match": true, "phase_class": "mixed"},
    {"primes": [5,13,97,113], "r": 4, "z_lhs": 0, "z_rhs": 0, "match": true, "phase_class": "mixed"},
    {"primes": [5,13,97,181], "r": 4, "z_lhs": 0, "z_rhs": 0, "match": true, "phase_class": "mixed"},
    {"primes": [5,13,101], "r": 3, "z_lhs": 0, "z_rhs": 0, "match": true, "phase_class": "mixed"},
    {"primes": [5,13,101,109], "r": 4, "z_lhs": 0, "z_rhs": 0, "match": true, "phase_class": "mixed"},
    {"primes": [5,13,101,113], "r": 4, "z_lhs": 0, "z_rhs": 0, "match": true, "phase_class": "mixed"},
    {"primes": [5,13,101,149], "r": 4, "z_lhs": 0, "z_rhs": 0, "match": true, "phase_class": "mixed"},
    {"primes": [5,13,101,157], "r": 4, "z_lhs": 0, "z_rhs": 0, "match": true, "phase_class": "mixed"},
    {"primes": [5,13,101,173], "r": 4, "z_lhs": 0, "z_rhs": 0, "match": true, "phase_class": "mixed"},
    {"primes": [5,13,109], "r": 3, "z_lhs": 0, "z_rhs": 0, "match": true, "phase_class": "mixed"},